{
  "schemaVersion": 1,
  "id": "lsync-oem",
  "visibility": "public",
  "category": "sales",
  "titleLines": [
    "Lシンク",
    "OEMパートナーのご案内"
  ],
  "type": "OEM / LINE AI",
  "latestChange": "OEMパートナー向けの案内（B-01）を公開し、資料インデックスのB-01を開ける行にした",
  "latestChangeFor": "45d149dc8113d2df650f4a202e03e27a5d96fee0"
}
