{
  "schemaVersion": 1,
  "id": "hanasu-dake-channel",
  "route": "hanasu-dake-channel",
  "visibility": "public",
  "category": "build",
  "titleLines": [
    "話すだけチャンネル（仮称）",
    "声から動画・YouTube・SNS告知まで"
  ],
  "type": "SERVICE / AVATAR VIDEO",
  "latestChange": "中小企業の経営者向けに、話した声から資料・アバター動画・YouTube公開・SNS告知までを任せる直販LPを新しく公開しました。",
  "latestChangeFor": "f2725774c91f3529f8ded3aa86ed677739a426a5"
}
