{
  "schemaVersion": 1,
  "id": "ai-business-starter-pack",
  "visibility": "public",
  "category": "build",
  "titleLines": [
    "AI事業",
    "スタートパック"
  ],
  "type": "SERVICE / AI BUSINESS STARTER",
  "latestChange": "ヒーローコピーを5秒ごとに切り替え、スクロール方向に応じてヘッダーが出入りする導線へ更新しました。",
  "latestChangeFor": "f94516f414e82e8f178bdc29e765958015ea3a40"
}
