{
  "schemaVersion": 1,
  "id": "jmatch-engine",
  "visibility": "public",
  "category": "work",
  "titleLines": [
    "Jマッチエンジン"
  ],
  "type": "SERVICE / BUSINESS PLANNING",
  "latestChange": "会員向けの使い方動画を「会員登録をする」「自社に合った制度を知りたい」「会員特典やセミナー案内を見たい」の3本に作り直しました。",
  "latestChangeFor": "c4a9e28d2ebb47157e86200b4d3dccac49af1ecc"
}
