{
  "schemaVersion": 1,
  "id": "pack-indexes",
  "visibility": "public",
  "category": "sales",
  "titleLines": [
    "インデックスの",
    "インデックス"
  ],
  "type": "INDEX / ALL SERVICES",
  "latestChange": "アバターソリューションにOEMの資料4点が加わり、件数を16点（いま開ける15点）に更新しました。",
  "latestChangeFor": "b50c6ce9253ba7923c524d8dada4e7323199f121"
}
