{
  "schemaVersion": 1,
  "id": "jev-solution",
  "visibility": "public",
  "category": "build",
  "titleLines": [
    "Jevソリューション",
    "資料インデックス"
  ],
  "type": "INDEX / SALES ASSETS",
  "latestChange": "資料インデックスを新規公開。直販4点・OEM4点の入口と、公開済みページの一覧を掲載",
  "latestChangeFor": "cc077fd2c3aeb73a01cc8f3ac6bc0fcd49136c63"
}
