{
  "schemaVersion": 1,
  "id": "ai-reception-hiyori",
  "visibility": "public",
  "category": "care",
  "titleLines": [
    "AI受電担当 ひより",
    "（おまかせ受電AI）"
  ],
  "type": "SERVICE / PHONE RECEPTION",
  "latestChange": "電話を受けたあとに案内する自己紹介LPを新規公開しました。受電後のショートメッセージ例、回答ナレッジの仕組み、10秒デモ、モニター募集、要望フォームを載せています。",
  "latestChangeFor": "86136bbcd096fc742e435a4203bede8b20b9104c"
}
