{
  "schemaVersion": 1,
  "id": "jev-avatar-partnership-lp",
  "route": "jev-avatar-partnership-lp",
  "visibility": "public",
  "category": "build",
  "titleLines": [
    "AIアバター共同事業",
    "パートナー募集"
  ],
  "type": "LANDING PAGE / JOINT BUSINESS",
  "latestChange": "五七五の句を縦書きの紙に浮かぶ見た目にし、アバターの声を急に切らずに小さくしてから止めるようにした",
  "latestChangeFor": "e13e73afdece143ea3b9ee5a43bc58ab099f2812"
}
