{
  "schemaVersion": 1,
  "id": "social-master-case-study",
  "visibility": "public",
  "category": "sales",
  "titleLines": [
    "ソーシャルマスター",
    "社内活用事例"
  ],
  "type": "CASE STUDY / SOCIAL MEDIA",
  "latestChange": "社内アカウントでの運用事例5件（フォロワー5人での商談獲得、X採用アカウント3週間で＋39人など）を公開しました。",
  "latestChangeFor": "8f7c99d1c040c8838e5986b0ecad58623521bd6f"
}
