{
  "schemaVersion": 1,
  "id": "ai-rpo-oem",
  "visibility": "public",
  "category": "people",
  "titleLines": [
    "AI RPO",
    "OEM提供のご案内"
  ],
  "type": "OEM / RPO",
  "latestChange": "見た目を作り替えました。灰色の地に白い角丸パネルを並べ、墨色と琥珀色の2色、英字の大見出しでまとめています。",
  "latestChangeFor": "0022a5a5cee7a6de3829cbc70a7d6c49c72ccf1a"
}
