{
  "schemaVersion": 1,
  "id": "writeup-ai-history",
  "visibility": "public",
  "category": "build",
  "titleLines": [
    "ライトアップ",
    "AIの歴史"
  ],
  "type": "COMPANY / AI HISTORY",
  "latestChange": "公開URLをwriteup表記へ統一し、1997年の統計・データ解析から現在のAIエージェント事業まで、約30年の歩みを一つの資料でたどれるようにしました。",
  "latestChangeFor": "462129f557eeb00757d513a4d73404586f3534f7"
}
