{
  "schemaVersion": 1,
  "id": "social-master-support",
  "visibility": "public",
  "category": "sales",
  "titleLines": [
    "ソーシャルマスター",
    "導入後サポート"
  ],
  "type": "CUSTOMER SUPPORT / SOCIAL MEDIA",
  "latestChange": "ご利用中のお客様向けに、月2時間の専門コンサルタント相談と操作の質問の行き先をまとめた案内を公開しました。",
  "latestChangeFor": "d9eb0fd5478b5bb8eb670df6829b5f67a80b23bf"
}
