{
  "schemaVersion": 1,
  "id": "media",
  "visibility": "public",
  "category": "build",
  "titleLines": [
    "SaaS Media"
  ],
  "type": "MEDIA / SERVICE CATALOG",
  "latestChange": "村田峻平・菅野敬彦・菅野秀平・松井友美のインタビューを追加し、計7本の人物記事へ刷新しました。",
  "latestChangeFor": "9bc25319c9435da8e4183c03ea48510e681d2ac9"
}
