{
  "schemaVersion": 1,
  "id": "focus-2026-09",
  "visibility": "public",
  "category": "build",
  "titleLines": [
    "2026年9月",
    "注力サービス"
  ],
  "type": "INDEX / FEATURED SERVICES",
  "latestChange": "JマッチエンジンOEMの料金表記を個別見積もりに更新",
  "latestChangeFor": "9f7760c4136804ab62582780e18d9d275a695984"
}
