{
  "schemaVersion": 1,
  "id": "ceotwin",
  "visibility": "public",
  "category": "sales",
  "titleLines": [
    "CEOTwin",
    "社長の知恵を預かる、ツイン銀行。"
  ],
  "type": "CONCEPT LP / CEO DIGITAL TWIN",
  "latestChange": "ツイン銀行のコンセプト、4つの活用用途、競合比較と料金の検討案を公開",
  "latestChangeFor": "383f044d6592b50d084d43c96113dd36f7ddeeed"
}
