{
  "schemaVersion": 1,
  "id": "tsubame-lead-qa",
  "visibility": "public",
  "category": "sales",
  "titleLines": [
    "つばめリード",
    "他社比較Q&A"
  ],
  "type": "SERVICE / FORM SALES",
  "latestChange": "録画の保存期間を90日に訂正し、提案文は御社が用意しAIがフォームへ入力する形に説明を直しました。12万通未満は個別相談と明記。",
  "latestChangeFor": "9a8b352e11ef8346bc351ccb34620adc33252e39"
}
