{
  "schemaVersion": 1,
  "id": "worklog-insight",
  "visibility": "public",
  "category": "work",
  "titleLines": [
    "ワークログ・",
    "インサイト"
  ],
  "type": "SERVICE / WORK ANALYTICS",
  "latestChange": "オプション・その他に、計画書の素案をAIが書く「ワークログ・ブループリント」を追加しました。",
  "latestChangeFor": "e6d4df60e1877824b3eb5a95132d8fcb83ceffdc"
}
