{
  "schemaVersion": 1,
  "id": "worklog-blueprint",
  "visibility": "public",
  "category": "work",
  "titleLines": [
    "ワークログ",
    "ブループリント"
  ],
  "type": "SERVICE / OPTION",
  "latestChange": "ワークログ・インサイトの記録から業務改善計画書の素案をAIが書く有料オプション（開発中）のLPを公開しました。",
  "latestChangeFor": "e6d4df60e1877824b3eb5a95132d8fcb83ceffdc"
}
