{
  "schemaVersion": 1,
  "id": "sogyo-index",
  "visibility": "public",
  "category": "build",
  "titleLines": [
    "創業支援パック",
    "資料インデックス"
  ],
  "type": "INDEX / STARTUP SUPPORT",
  "latestChange": "創業支援パックの資料インデックスを新規公開。直販4点・OEM4点・企画3点の入口と、公開済みの適性診断への導線を掲載",
  "latestChangeFor": "2f07944a35fc7a6493d644c237d64df562c3265f"
}
