{
  "schemaVersion": 1,
  "id": "sonoba-flow",
  "visibility": "public",
  "category": "work",
  "titleLines": [
    "その場フロー",
    "会議中に業務フロー図"
  ],
  "type": "SERVICE / BUSINESS FLOW AI",
  "latestChange": "サービスサイトを新規公開。仕組み（Jev×LLMの4段）と先行導入の申し込み導線を掲載",
  "latestChangeFor": "cc077fd2c3aeb73a01cc8f3ac6bc0fcd49136c63"
}
