{
  "schemaVersion": 1,
  "id": "omakase-juden-pack",
  "visibility": "public",
  "category": "care",
  "titleLines": [
    "おまかせ受電AI",
    "資料インデックス"
  ],
  "type": "INDEX / PHONE RECEPTION",
  "latestChange": "B-01 OEMパートナーのご案内を公開し、開ける行に切り替えた",
  "latestChangeFor": "5a1031b8d068294e2efd17fa8366c4e65211aa6c"
}
