{
  "schemaVersion": 1,
  "id": "web-agency-kit",
  "visibility": "public",
  "category": "build",
  "titleLines": [
    "ホームページ制作会社",
    "スタートパック"
  ],
  "type": "SERVICE / WEB PRODUCTION",
  "latestChange": "V3の左カラムに、セクションごとの線画イラストを追加",
  "latestChangeFor": "dedbeaa0240b10d723472523274056f8311d3cb4"
}
