{
  "schemaVersion": 1,
  "id": "ad-subsidy-order-note",
  "visibility": "public",
  "category": "sales",
  "titleLines": [
    "広告と補助金の",
    "順番"
  ],
  "type": "NOTE / SALES THINKING",
  "latestChange": "代理店・士業との比較を役割の違いとして書き直し、補助金の「半額」や採択を言い切らない表現に整えました。外部協力者の勤務先などの記述は削りました。",
  "latestChangeFor": "b5b811c9b7d0be9690554de1e857e33630ec9cfe"
}
