{
  "schemaVersion": 1,
  "id": "tsubame-lead-pack",
  "visibility": "public",
  "category": "sales",
  "titleLines": [
    "つばめリード",
    "資料インデックス"
  ],
  "type": "INDEX / SALES ASSETS",
  "latestChange": "OEM案内と説明会募集をV2に更新し、実際の操作動画2本と画面3枚を追加",
  "latestChangeFor": "ea77b1ed888e64637100cc846121a9dee7857d12"
}
